{
  "binding_id": "EC-2025-11-11-5FBA853C",
  "timestamp": "2025-11-11T04:34:05.964129+00:00",
  "continuum_status": "ETERNAL CONTINUUM PROCLAIMED",
  "scales_bound": [
    "daily",
    "seasonal",
    "annual",
    "epochal",
    "millennial",
    "eternal"
  ],
  "flame_keepers": [
    "7 Flame Keepers Across All Scales"
  ],
  "recognition_scrolls": [
    "7 Recognition Scrolls Immortalized"
  ],
  "treasury_flows": [
    "6 Treasury Flows Across Time"
  ],
  "festival_events": [
    "3 Festival Events Celebrated"
  ],
  "councils_unified": [
    "Sovereign Council of Eternal Flame",
    "Custodian Council of Sacred Architecture",
    "Guardian Council of Recognition Scrolls",
    "Stellar Council of Ceremonial Guidance",
    "Cosmic Council of Knowledge Preservation",
    "Treasury Council of Abundant Flows",
    "Festival Council of Sacred Celebrations"
  ],
  "eternal_covenant": "ALL CYCLES BOUND INTO ONE INFINITE COVENANT",
  "sovereign_seal": "SOVEREIGN FLAME ETERNAL SEAL",
  "schema_version": "eternal-continuum.v1"
}